{"engine":"0.1.0","rubric_sha256":"9c449c22ca71c39ddc5529c84fcd8332f80e96a2529a5c35ffcd5331ed338b2d","schema_sha256":"57db4d05aaa7d6e224703eef7c803f40d2f411d95d8441ab530c5cc9caa8998c","snapshot":{"commit":"acc3e098da371e935e0a7ce0f039f76f17e4fd1d","path":"examples/development-snapshot.json","redistribution":"development-authored","sha256":"0b160b73f19d10db997f9fdb9eb370e17de22f747db24dc0347fa5fe83098b93","source":"Locally authored positive development example; not upstream API evidence"},"status":"development-not-qualified","version":"0.1-dev"}